{
  "format": "wow-guide-profile/v1",
  "schema_version": 1,
  "profile_id": "zuljan-malacrass-guide-v1",
  "title": "Zul'jan and Hex Lord Malacrass timed-mechanic context",
  "source": {
    "kind": "user_provided_guide_text",
    "title": "Serpent's Bargain / Usurper's Reprisal / The Claimed Vessel / Coiled Union",
    "content_sha256": "1FFBB3571CF956192B299FF221CF0ADA95A9AF9F903FE9C1C4B915BB4AADB77F",
    "notes": "Curated for timer relevance. Numeric damage values were intentionally omitted."
  },
  "encounter": {
    "id": null,
    "name": "Zul'jan and Hex Lord Malacrass",
    "aliases": ["Zul'jan", "Hex Lord Malacrass"],
    "actors": ["Zul'jan", "Hex Lord Malacrass", "The Coiled Altar"]
  },
  "timing_policy": {
    "encounter_schedule_source": "observed_logs_only",
    "effect_intervals_are_cast_intervals": false,
    "guide_context_can_enable_timer": false,
    "damage_values_included": false
  },
  "phases": [
    {"id": "stage_one", "name": "Serpent's Bargain", "order": 1, "actors": ["Zul'jan"]},
    {"id": "stage_two", "name": "Usurper's Reprisal", "order": 2, "actors": ["Hex Lord Malacrass"]},
    {"id": "intermission", "name": "The Claimed Vessel", "order": 3, "actors": ["Zul'jan", "Hex Lord Malacrass"], "guide_transition": "Soulbinding begins the intermission."},
    {"id": "stage_three", "name": "Coiled Union", "order": 4, "actors": ["Zul'jan", "Hex Lord Malacrass"], "guide_transition": "Soulbound marks the combined final stage."}
  ],
  "mechanics": [
    {
      "id": "fangs-of-the-coiled-altar",
      "name": "Fangs of the Coiled Altar",
      "actors": ["Zul'jan", "The Coiled Altar"],
      "phases": ["stage_one"],
      "difficulties": ["raid_finder", "normal", "heroic", "mythic"],
      "categories": ["raidwide", "channel", "tank_followup", "arena_hazard"],
      "severity": "high",
      "summary": "Channel that creates a repeated raid event, empowers subsequent melee attacks, and creates ground hazards.",
      "facts": {"channel_duration_seconds": 8, "application_interval_seconds": 1},
      "timer_policy": {"mode": "observed_static", "candidate": true, "reason": "Primary boss cast suitable for a timer only if repeated pulls show stable cast timing."},
      "relationships": [
        {"type": "applies", "target": "twinfang-toxin"},
        {"type": "creates", "target": "noxious-ground"}
      ]
    },
    {
      "id": "twinfang-toxin",
      "name": "Twinfang Toxin",
      "actors": ["Zul'jan"],
      "phases": ["stage_one"],
      "difficulties": ["raid_finder", "normal", "heroic", "mythic"],
      "categories": ["tank", "melee_empowerment", "stack_consumption"],
      "severity": "high",
      "summary": "Follow-up tank pressure whose applications are consumed by melee attacks.",
      "facts": {},
      "timer_policy": {"mode": "reactive", "candidate": false, "reason": "Track as an aura consequence of Fangs rather than as an independent pull timer."}
    },
    {
      "id": "noxious-ground",
      "name": "Noxious Ground",
      "actors": ["The Coiled Altar"],
      "phases": ["stage_one"],
      "difficulties": ["raid_finder", "normal", "heroic", "mythic"],
      "categories": ["ground_hazard", "positioning"],
      "severity": "high",
      "summary": "Expanding ground hazard created beneath altar mouths.",
      "facts": {},
      "timer_policy": {"mode": "reactive", "candidate": false, "reason": "Location is dynamic; display from live ground-effect or position evidence."}
    },
    {
      "id": "toxic-deluge",
      "name": "Toxic Deluge",
      "actors": ["The Coiled Altar", "Zul'jan"],
      "phases": ["stage_one", "stage_three"],
      "difficulties": ["raid_finder", "normal", "heroic", "mythic"],
      "categories": ["impact_locations", "add_creation", "positioning"],
      "severity": "high",
      "summary": "Primary cast that creates venom impact locations and persistent globule mechanics.",
      "facts": {"impact_radius_yards": 4, "guide_contains_multiple_mythic_variants": true},
      "timer_policy": {"mode": "observed_static", "candidate": true, "reason": "Warn for the parent cast when log observations establish stable occurrence times."},
      "relationships": [
        {"type": "creates", "target": "coalesced-venom"},
        {"type": "may_create", "target": "virulent-cyst", "condition": "mythic variant"},
        {"type": "may_create", "target": "virulent-mutation", "condition": "mythic variant"}
      ]
    },
    {
      "id": "coalesced-venom",
      "name": "Coalesced Venom",
      "actors": ["Coalesced Venom"],
      "phases": ["stage_one", "stage_three"],
      "difficulties": ["raid_finder", "normal", "heroic", "mythic"],
      "categories": ["spawn", "interactive_object", "raid_pulse"],
      "severity": "moderate",
      "summary": "Persistent globule created by Toxic Deluge and recreated after player interaction.",
      "facts": {"pulse_interval_seconds": 2},
      "timer_policy": {"mode": "reactive", "candidate": false, "reason": "Spawn and destruction timing depend on player actions."},
      "relationships": [
        {"type": "triggers_when_destroyed", "target": "venom-rupture"},
        {"type": "applies_when_collected", "target": "volatile-venom"}
      ]
    },
    {
      "id": "venom-rupture",
      "name": "Venom Rupture",
      "actors": ["Coalesced Venom", "Virulent Mutation"],
      "phases": ["stage_one", "stage_three"],
      "difficulties": ["raid_finder", "normal", "heroic", "mythic"],
      "categories": ["conditional_raidwide", "stacking_effect"],
      "severity": "critical",
      "summary": "Raid-wide consequence triggered by globule destruction; behavior varies by difficulty.",
      "facts": {"duration_seconds": 10, "tick_interval_seconds": 2},
      "timer_policy": {"mode": "conditional", "candidate": false, "reason": "Emit from the destruction trigger, not from an encounter-relative schedule."}
    },
    {
      "id": "volatile-venom",
      "name": "Volatile Venom",
      "actors": ["Coalesced Venom"],
      "phases": ["stage_one", "stage_three"],
      "difficulties": ["raid_finder", "normal", "heroic", "mythic"],
      "categories": ["player_debuff", "proximity", "drop_hazard"],
      "severity": "high",
      "summary": "Player-carried proximity effect that recreates a globule when it expires.",
      "facts": {"duration_seconds": 5, "radius_yards": 5, "mythic_expiration_applies_tainted_blood": true},
      "timer_policy": {"mode": "reactive", "candidate": false, "reason": "Use aura application and expiration events for personal warnings."},
      "relationships": [{"type": "creates_on_expiration", "target": "coalesced-venom"}]
    },
    {
      "id": "virulent-cyst",
      "name": "Virulent Cyst",
      "actors": ["Virulent Cyst"],
      "phases": ["stage_one", "stage_three"],
      "difficulties": ["mythic"],
      "categories": ["spawn", "add"],
      "severity": "high",
      "summary": "Mythic globule mutation that periodically creates more Coalesced Venoms.",
      "facts": {},
      "timer_policy": {"mode": "conditional", "candidate": false, "reason": "Its existence depends on the active Mythic variant and Toxic Deluge result."},
      "relationships": [{"type": "uses", "target": "caustic-secretion"}]
    },
    {
      "id": "caustic-secretion",
      "name": "Caustic Secretion",
      "actors": ["Virulent Cyst"],
      "phases": ["stage_one", "stage_three"],
      "difficulties": ["mythic"],
      "categories": ["spawn_repeat", "impact_locations"],
      "severity": "high",
      "summary": "Cyst ability that repeatedly creates two Coalesced Venoms.",
      "facts": {"repeat_interval_seconds": 6, "spawn_count": 2, "interval_origin": "virulent_cyst_active"},
      "timer_policy": {"mode": "reactive", "candidate": true, "reason": "A source-relative timer may start after a Virulent Cyst is observed; do not anchor it to pull time."},
      "relationships": [{"type": "creates", "target": "coalesced-venom"}]
    },
    {
      "id": "virulent-mutation",
      "name": "Virulent Mutation",
      "actors": ["Virulent Mutation"],
      "phases": ["stage_one", "stage_three"],
      "difficulties": ["mythic"],
      "categories": ["spawn", "raid_pulse", "chain_reaction"],
      "severity": "critical",
      "summary": "Mythic globule variant with player-driven chain-reaction behavior.",
      "facts": {"pulse_interval_seconds": 1},
      "timer_policy": {"mode": "conditional", "candidate": false, "reason": "Spawn and detonation timing are dynamic."},
      "relationships": [{"type": "may_trigger_multiple", "target": "venom-rupture"}]
    },
    {
      "id": "guillotine",
      "name": "Guillotine",
      "actors": ["Zul'jan"],
      "phases": ["stage_one"],
      "difficulties": ["raid_finder", "normal", "heroic", "mythic"],
      "categories": ["targeted_soak", "split_hit", "delayed_followup"],
      "severity": "critical",
      "summary": "Targeted soak followed by an axe eruption; failed participation causes Execution.",
      "facts": {"soak_radius_yards": 9, "minimum_soakers": 5},
      "timer_policy": {"mode": "observed_static", "candidate": true, "reason": "Warn for the boss cast when repeated logs show stable timing."},
      "relationships": [
        {"type": "failure_triggers", "target": "execution", "condition": "fewer than five players hit"},
        {"type": "followed_by", "target": "widows-kiss"}
      ]
    },
    {
      "id": "execution",
      "name": "Execution",
      "actors": ["Zul'jan"],
      "phases": ["stage_one"],
      "difficulties": ["raid_finder", "normal", "heroic", "mythic"],
      "categories": ["failed_soak", "conditional_raidwide"],
      "severity": "critical",
      "summary": "Failure event when Guillotine does not hit enough players.",
      "facts": {},
      "timer_policy": {"mode": "conditional", "candidate": false, "reason": "Report as a failed-soak consequence rather than predict it."}
    },
    {
      "id": "widows-kiss",
      "name": "Widow's Kiss",